{
  "$schema": "https://json-schema.org/draft/2020-12/schema",
  "type": "object",
  "additionalProperties": false,
  "required": [
    "name",
    "cli",
    "version",
    "platforms",
    "providers",
    "routes",
    "tools"
  ],
  "properties": {
    "$schema": {
      "type": "string"
    },
    "name": {
      "const": "OpenAgentLayer"
    },
    "cli": {
      "const": "oal"
    },
    "version": {
      "type": "string",
      "pattern": "^[0-9]+\\.[0-9]+\\.[0-9]+$"
    },
    "platforms": {
      "type": "array",
      "minItems": 1,
      "uniqueItems": true,
      "items": {
        "enum": [
          "codex",
          "claude",
          "opencode",
          "kilo",
          "windsurf",
          "cline",
          "gemini",
          "cursor"
        ]
      }
    },
    "providers": {
      "type": "array",
      "minItems": 1,
      "uniqueItems": true,
      "items": {
        "type": "string",
        "minLength": 1
      }
    },
    "routes": {
      "type": "array",
      "minItems": 1,
      "uniqueItems": true,
      "items": {
        "type": "string",
        "minLength": 1
      }
    },
    "tools": {
      "type": "array",
      "minItems": 1,
      "uniqueItems": true,
      "items": {
        "type": "string",
        "minLength": 1
      }
    }
  }
}
