{
  "$schema": "./schema/oal.schema.json",
  "name": "OpenAgentLayer",
  "cli": "oal",
  "version": "4.0.0",
  "platforms": [
    "codex",
    "claude",
    "opencode"
  ],
  "providers": [
    "caveman",
    "rtk",
    "bmad-method",
    "taste-skill"
  ],
  "routes": [
    "subscriptions",
    "models"
  ],
  "tools": [
    "act",
    "ast-grep",
    "bat",
    "bun",
    "context7",
    "ctx7",
    "deepwiki",
    "depcheck",
    "direnv",
    "docker-compose",
    "duckdb",
    "eza",
    "fd",
    "gh",
    "git-delta",
    "gum",
    "homebrew",
    "httpie",
    "hyperfine",
    "jq",
    "just",
    "knip",
    "mise",
    "mypy",
    "node",
    "playwright",
    "pytest",
    "repomix",
    "rg",
    "rtk",
    "ruff",
    "rust",
    "semgrep",
    "shellcheck",
    "shfmt",
    "sqlite-utils",
    "tokei",
    "tree",
    "tsc",
    "uv",
    "watchexec",
    "yq"
  ]
}
